{
 "version": 1,
 "area": "plugins-and-installs",
 "description": "Installing the family: wicked-installer per agent CLI, the garden plugin per host, editor plugins and MCP servers built and installed by crew workflows.",
 "capabilities": [
  {
   "id": "plugins.crew.editors.conformance-timeout",
   "title": "Install-time conformance timeout honours WG_EDITOR_CONFORMANCE_TIMEOUT",
   "surface": "background",
   "user_path": "Start the proof daemon with WG_EDITOR_CONFORMANCE_TIMEOUT=<s> and install a pack.",
   "deps": [
    "proof crew daemon",
    "chromium"
   ],
   "cost": "M",
   "tags": [
    "plugins-and-installs",
    "crew",
    "plugins",
    "editors",
    "governance",
    "install"
   ],
   "required_evidence": [
    "event-log"
   ],
   "oracle": {
    "kind": "manual",
    "category": "untyped",
    "reason": "deterministic in principle, but the inventory states it as prose (library calls, SQL, multi-step sequences) that the normaliser could not reduce to dom/api/event/file/exit checks; restate it as typed checks before it can certify: the conformance child receives the env bound; crew's overall cap == conformanceCapMs(editors, bound); a slow host page does not fail a correct editor"
   },
   "oracle_text": "the conformance child receives the env bound; crew's overall cap == conformanceCapMs(editors, bound); a slow host page does not fail a correct editor",
   "covers": [],
   "scenarios": [
    {
     "ref": "wicked-crew:packages/crew/tests/editor-conformance-cap.test.ts",
     "fidelity": "integration"
    }
   ],
   "sources": [
    "wicked-crew:packages/crew/src/editors/pack-install.ts"
   ],
   "origin": "inventory-2026-10-20"
  },
  {
   "id": "plugins.crew.editors.first-party-discovery",
   "title": "First-party editors discovered from studio's bundle at boot",
   "surface": "background",
   "user_path": "Start crew with a studio dist containing dist/editors/<id>/editor.json + index.html (built by studio scripts/build-editors.mjs).",
   "deps": [
    "crew daemon",
    "studio dist"
   ],
   "cost": "S",
   "tags": [
    "plugins-and-installs",
    "crew",
    "plugins",
    "editors"
   ],
   "required_evidence": [
    "event-log",
    "file-hash"
   ],
   "oracle": {
    "kind": "api",
    "method": "GET",
    "path": "/api/v1/editors",
    "expect": {
     "status": 200
    },
    "complete": false,
    "untyped": [
     "GET /api/v1/editors lists every dist/editors/<id> with sha256 == sha256(index.html)",
     "a symlinked dir/manifest/entry is skipped with a reason in the daemon log",
     "no studio bundle => no editors and no daemon-editors.json written"
    ]
   },
   "oracle_text": "GET /api/v1/editors lists every dist/editors/<id> with sha256 == sha256(index.html); a symlinked dir/manifest/entry is skipped with a reason in the daemon log; no studio bundle => no editors and no daemon-editors.json written",
   "covers": [
    "crew:route:GET /api/v1/editors"
   ],
   "scenarios": [
    {
     "ref": "wicked-crew:packages/crew/tests/editors.test.ts",
     "name": "discovers the first-party editors a studio bundle ships",
     "fidelity": "integration"
    },
    {
     "ref": "wicked-studio:tests/editorBundles.test.ts",
     "fidelity": "unit"
    }
   ],
   "sources": [
    "wicked-crew:packages/crew/src/editors/registry.ts",
    "wicked-studio:scripts/build-editors.mjs"
   ],
   "origin": "inventory-2026-10-20"
  },
  {
   "id": "plugins.crew.editors.mcp-session-grant",
   "title": "Install consent writes (and uninstall withdraws) the mcp.session grant",
   "surface": "api",
   "user_path": "Install an editor declaring mcp.session (e.g. garden's packs/garden-mcp-inspector) then uninstall it.",
   "deps": [
    "proof crew daemon",
    "core-ts with editor grants"
   ],
   "cost": "M",
   "tags": [
    "plugins-and-installs",
    "crew",
    "plugins",
    "editors",
    "mcp",
    "install"
   ],
   "required_evidence": [
    "api-transcript",
    "event-log"
   ],
   "oracle": {
    "kind": "manual",
    "category": "untyped",
    "reason": "deterministic in principle, but the inventory states it as prose (library calls, SQL, multi-step sequences) that the normaliser could not reduce to dom/api/event/file/exit checks; restate it as typed checks before it can certify: after install: EDITOR-GRANTS rule excludes contains editor:<id>@<v>#<sha>/mcp.session and response granted[] lists it; updating to a build without it drops the token; DELETE withdraws the token before removal (503 if it cannot, editor kept)"
   },
   "oracle_text": "after install: EDITOR-GRANTS rule excludes contains editor:<id>@<v>#<sha>/mcp.session and response granted[] lists it; updating to a build without it drops the token; DELETE withdraws the token before removal (503 if it cannot, editor kept)",
   "covers": [
    "garden:pack:garden-mcp-inspector"
   ],
   "scenarios": [
    {
     "ref": "wicked-garden:tests/editor/test_editor_scripts.py",
     "name": "test_install_reports_the_grants_crew_wrote_or_why_not",
     "fidelity": "unit"
    },
    {
     "ref": "wicked-crew:packages/crew/tests/editors.test.ts",
     "fidelity": "integration"
    }
   ],
   "sources": [
    "wicked-crew:packages/crew/src/editors/routes.ts:editInstallGrants,grantToken",
    "wicked-garden:packs/garden-mcp-inspector/wicked-pack.json"
   ],
   "origin": "inventory-2026-10-20"
  },
  {
   "id": "plugins.crew.garden-required",
   "title": "Crew refuses onboarding/launch without a usable garden",
   "surface": "api",
   "user_path": "Run crew with no garden or a garden older than the minimum; GET /api/v1/health.",
   "deps": [
    "proof crew daemon"
   ],
   "cost": "S",
   "tags": [
    "plugins-and-installs",
    "crew",
    "plugins",
    "launch"
   ],
   "required_evidence": [
    "api-transcript"
   ],
   "oracle": {
    "kind": "manual",
    "category": "untyped",
    "reason": "deterministic in principle, but the inventory states it as prose (library calls, SQL, multi-step sequences) that the normaliser could not reduce to dom/api/event/file/exit checks; restate it as typed checks before it can certify: health carries a blocking skills.garden finding naming found vs required; POST /repos and launch answer 422 garden_required / base_skill_refused (assert only on a proof daemon)"
   },
   "oracle_text": "health carries a blocking skills.garden finding naming found vs required; POST /repos and launch answer 422 garden_required / base_skill_refused (assert only on a proof daemon)",
   "covers": [
    "crew:route:GET /api/v1/health",
    "crew:route:POST /api/v1/repos"
   ],
   "scenarios": [
    {
     "ref": "wicked-crew:packages/crew/tests/garden-required.test.ts",
     "fidelity": "integration"
    }
   ],
   "sources": [
    "wicked-crew:packages/crew/src/api/routes.ts (skills.garden finding)"
   ],
   "origin": "inventory-2026-10-20"
  },
  {
   "id": "plugins.crew.install-verify",
   "title": "Verify a crew install: versions and engine binaries",
   "surface": "cli",
   "user_path": "`npm i -g wicked-crew`, `wicked-crew --version`, start `wicked-crew serve`, GET /api/v1/health and /api/v1/diagnostics.",
   "deps": [
    "network (npm)",
    "a free port for a proof daemon"
   ],
   "cost": "M",
   "tags": [
    "plugins-and-installs",
    "crew",
    "plugins",
    "install"
   ],
   "required_evidence": [
    "cli-transcript"
   ],
   "oracle": {
    "kind": "exit",
    "cmd": "npm i -g wicked-crew",
    "code": 0,
    "complete": false,
    "untyped": [
     "--version prints three lines (wicked-crew, wicked-core-ts, wicked-studio)",
     "health .version == package version",
     "diagnostics .components has crew, studioBundle, coreTs, engineBinaries {wicked-core, wicked-estate} (seen on :7721: crew 0.15.4, wicked-core 0.4.0, wicked-estate 0.29.2)"
    ]
   },
   "oracle_text": "--version prints three lines (wicked-crew, wicked-core-ts, wicked-studio); health .version == package version; diagnostics .components has crew, studioBundle, coreTs, engineBinaries {wicked-core, wicked-estate} (seen on :7721: crew 0.15.4, wicked-core 0.4.0, wicked-estate 0.29.2)",
   "covers": [
    "crew:cli:serve",
    "crew:route:GET /api/v1/health"
   ],
   "scenarios": [
    "planned"
   ],
   "sources": [
    "wicked-installer:registry.json (wicked-core instructions)",
    "wicked-crew:packages/crew/src/api/server.ts"
   ],
   "origin": "inventory-2026-10-20"
  },
  {
   "id": "plugins.crew.skills.garden-source",
   "title": "Crew finds the installed garden plugin (marketplace cache first, installer copy last)",
   "surface": "api",
   "user_path": "Start crew with garden registered in Claude Code (or only an installer copy); GET /api/v1/skills and /api/v1/diagnostics.",
   "deps": [
    "crew daemon (read-only GETs)"
   ],
   "cost": "S",
   "tags": [
    "plugins-and-installs",
    "crew",
    "plugins",
    "install",
    "skills"
   ],
   "required_evidence": [
    "api-transcript"
   ],
   "oracle": {
    "kind": "all",
    "of": [
     {
      "kind": "api",
      "method": "GET",
      "path": "/api/v1/skills",
      "expect": {
       "status": 200
      }
     },
     {
      "kind": "api",
      "method": "GET",
      "path": "/api/v1/diagnostics",
      "expect": {
       "status": 200
      }
     }
    ],
    "complete": false,
    "untyped": [
     "GET /api/v1/skills .installed.source {kind, path, plugin_version}: kind cache when <config>/plugins/cache/wicked-garden/wicked-garden/<highest semver> exists (wins over any copy), 'installer-copy' only as last resort with a skills.source WARNING in GET /api/v1/diagnostics .skills.findings",
     "WICKED_CREW_SKILLS_SOURCE overrides",
     "symlinked levels skipped"
    ]
   },